{
  "$schema": "../task.schema.json",
  "id": "V200-02",
  "title": "Release Gate P1 - Production Env Activation",
  "status": "verify",
  "priority": "high",
  "files": [
    ".project/state.json",
    ".project/tasks/V200-01.json",
    ".project/tasks/V200-02.json",
    "README.md",
    "AGENTS.md",
    "CLAUDE.md",
    "42-v2-ai-team-mode-plan.md",
    "33-feature-flags.md",
    "18-team-mode-spec.md",
    "12-security-and-env.md",
    "13-deployment.md",
    "docs/audits/project-audit-2026-06-27.md",
    "supabase/migrations/20260702211527_grant_anonymous_sessions_service_role.sql"
  ],
  "checksRequired": [
    "vercel-env:upstash-or-kv-aliases",
    "vercel-env:ENABLE_TEAM_MODE",
    "vercel-env:NEXT_PUBLIC_ENABLE_TEAM_MODE",
    "production-redeploy",
    "production-smoke:health",
    "production-smoke:team-ui",
    "production-smoke:team-run-auth",
    "production-smoke:upstash-rate-limit",
    "state:check",
    "docs:check"
  ],
  "checksPassed": [
    "vercel-env:upstash-or-kv-aliases",
    "vercel-env:ENABLE_TEAM_MODE",
    "vercel-env:NEXT_PUBLIC_ENABLE_TEAM_MODE",
    "production-redeploy",
    "production-smoke:health",
    "production-smoke:team-ui",
    "production-smoke:team-run-auth",
    "production-smoke:upstash-rate-limit",
    "production-smoke:guest-session",
    "production-smoke:team-run-authenticated",
    "production-smoke:team-run-rate-limit",
    "production-smoke:admin-rate-limit",
    "state:check",
    "docs:check"
  ],
  "lastUpdated": "2026-07-02T21:22:20.656Z",
  "transitions": [
    {
      "from": null,
      "to": "planned",
      "at": "2026-06-28T06:38:24.000Z",
      "note": "Production Team Mode activation is tracked separately from PR30. Code and local checks are green, but production still requires Upstash Redis env (UPSTASH_REDIS_REST_* or Vercel Marketplace KV_REST_API_* aliases), ENABLE_TEAM_MODE=true, NEXT_PUBLIC_ENABLE_TEAM_MODE=true, redeploy, and smoke verification."
    },
    {
      "from": "planned",
      "to": "in_progress",
      "at": "2026-06-28T06:38:24.000Z",
      "note": "Current blocker: production /api/team-run can return 503 if the backend ENABLE_TEAM_MODE flag is not enabled while UI is exposed."
    },
    {
      "from": "in_progress",
      "to": "in_progress",
      "at": "2026-07-02T19:19:43.188Z",
      "note": "Vercel env name audit still does not show UPSTASH_REDIS_REST_URL/UPSTASH_REDIS_REST_TOKEN or Vercel Marketplace KV_REST_API_URL/KV_REST_API_TOKEN aliases, ENABLE_TEAM_MODE, or NEXT_PUBLIC_ENABLE_TEAM_MODE. Production /api/team-run remains blocked by SERVICE_UNAVAILABLE until those values are supplied and redeployed."
    },
    {
      "from": "in_progress",
      "to": "in_progress",
      "at": "2026-07-02T20:11:16.167Z",
      "note": "Repo now supports Vercel Marketplace KV_REST_API_URL/KV_REST_API_TOKEN aliases for Upstash-backed rate limiting, but live Vercel env ls still lacks UPSTASH_REDIS_REST_* or KV_REST_API_* plus ENABLE_TEAM_MODE and NEXT_PUBLIC_ENABLE_TEAM_MODE. Production /api/team-run still returns 503 SERVICE_UNAVAILABLE."
    },
    {
      "from": "in_progress",
      "to": "verify",
      "at": "2026-07-02T21:22:20.656Z",
      "note": "Production activation completed: Upstash Marketplace KV aliases and both Team Mode flags are present in Vercel Production; deployment dpl_3XiR5XcnrsWutgjfw6Tfd5z9rn3o is Ready and aliased to new-era-ai-platform.vercel.app; health/models smoke passed; /team renders active roles; unauthenticated /api/team-run returns 401 AUTH_REQUIRED instead of 503; authenticated /api/team-run returned 200 with 4 steps using allowlisted openai/gpt-oss-20b:free. Supabase migration grant_anonymous_sessions_service_role fixed live /api/guest 42501; /api/guest returned 201/200 and 429 under limit test; Team Mode app rate limit returned 400,400,400,429 before model calls; admin /api/admin/stats returned 200x60 then 429. A default model smoke attempt hit OpenRouter 429, so provider quota remains an operational watch item, not an activation blocker. Task remains verify until commitHash exists."
    }
  ],
  "notes": "Definition of Done evidence is complete for production activation: Vercel Production has Upstash/KV aliases, ENABLE_TEAM_MODE=true, and NEXT_PUBLIC_ENABLE_TEAM_MODE=true; production redeploy is Ready and aliased; /api/health and /api/models smoke passed; /team renders active Team Mode UI; unauthenticated POST /api/team-run is blocked by auth instead of feature-flag 503; authenticated Team Mode run succeeded with 4 role steps on an allowlisted model; Upstash-backed rate limits were verified for Team Mode, admin routes, and /api/guest. Supabase service_role table grants for anonymous_sessions were fixed by migration 20260702211527_grant_anonymous_sessions_service_role.sql. Status is verify, not done, because task.schema.json requires commitHash for done."
}
