{
  "$schema": "../task.schema.json",
  "id": "V063-01",
  "title": "v0.6.3 Auth SSR",
  "status": "done",
  "priority": "high",
  "files": [
    "20-auth-guest-profile-plan.md",
    "src/lib/supabase.ts",
    "src/lib/server/supabase.ts",
    "src/app/login/page.tsx",
    "src/app/signup/page.tsx"
  ],
  "checksRequired": [
    "typecheck",
    "lint",
    "build"
  ],
  "checksPassed": [
    "typecheck",
    "lint",
    "build",
    "smoke",
    "test"
  ],
  "lastUpdated": "2026-06-17T10:56:43.050Z",
  "commitHash": "25a651f",
  "transitions": [
    {
      "from": null,
      "to": "planned",
      "at": "2026-06-10T00:00:00.000Z",
      "note": "Migrated from 22-codex-action-backlog.md (Backlog task 4)."
    },
    {
      "from": "planned",
      "to": "verify",
      "at": "2026-06-17T10:27:34.556Z",
      "note": "Implementation exists in working tree; awaiting full verification, docs sync and commit."
    },
    {
      "from": "verify",
      "to": "verify",
      "at": "2026-06-17T10:49:37.334Z"
    },
    {
      "from": "verify",
      "to": "verify",
      "at": "2026-06-17T10:49:38.097Z"
    },
    {
      "from": "verify",
      "to": "verify",
      "at": "2026-06-17T10:49:38.870Z"
    },
    {
      "from": "verify",
      "to": "verify",
      "at": "2026-06-17T10:55:15.185Z"
    },
    {
      "from": "verify",
      "to": "verify",
      "at": "2026-06-17T10:56:43.050Z"
    },
    {
      "from": "verify",
      "to": "done",
      "at": "2026-06-23T10:30:00.000Z",
      "note": "Offline checks pass (typecheck, lint, docs:check, state:check). Build verified via Vercel production deployment 25a651f (READY). Smoke verified via live production endpoint."
    }
  ],
  "notes": "Install @supabase/ssr; browser + server clients; cookie session refresh; /auth and /auth/callback; email/password login/signup/logout. OAuth (Google/GitHub) later."
}
