{
  "$schema": "../task.schema.json",
  "id": "V060-01",
  "title": "Verify Supabase migrations on a clean local database",
  "status": "planned",
  "priority": "medium",
  "files": [
    "supabase/migrations/",
    "08-database.md"
  ],
  "checksRequired": ["typecheck", "lint", "build"],
  "checksPassed": [],
  "lastUpdated": "2026-06-10T00:00:00.000Z",
  "commitHash": null,
  "transitions": [
    { "from": null, "to": "planned", "at": "2026-06-10T00:00:00.000Z", "note": "Migrated from 22-codex-action-backlog.md (Backlog task 1)." }
  ],
  "notes": "supabase db reset must pass from scratch; supabase db push must not try to re-apply removed 0007/0008; local and remote migration history must match."
}
