{
  "$schema": "../task.schema.json",
  "id": "V201-05",
  "title": "Add AWS KMS and Vercel OIDC Dependencies",
  "status": "done",
  "priority": "high",
  "files": [
    ".project/state.json",
    ".project/tasks/V201-05.json",
    "package.json",
    "package-lock.json"
  ],
  "checksRequired": [
    "audit",
    "typecheck",
    "lint",
    "test",
    "build",
    "state:check",
    "docs:check",
    "diff:check"
  ],
  "checksPassed": [
    "audit",
    "typecheck",
    "lint",
    "test",
    "build",
    "state:check",
    "docs:check",
    "diff:check"
  ],
  "lastUpdated": "2026-09-28T00:36:00+03:00",
  "commitHash": "d57bd51de840f903418f41ea12b81a75f9c479dc",
  "transitions": [
    {
      "from": null,
      "to": "planned",
      "at": "2026-09-28T00:34:00+03:00",
      "note": "Created after explicit user approval to continue AWS KMS/OIDC work."
    },
    {
      "from": "planned",
      "to": "in_progress",
      "at": "2026-09-28T00:34:00+03:00",
      "note": "Install only the official KMS client and Vercel AWS OIDC credential provider, pinned exactly, before adapter code."
    },
    {
      "from": "in_progress",
      "to": "verify",
      "at": "2026-09-28T00:35:30+03:00",
      "note": "Pinned dependencies installed via npm; CI passed audit, typecheck, lint, tests, build, state/docs and smoke; Vercel preview check passed."
    },
    {
      "from": "verify",
      "to": "done",
      "at": "2026-09-28T00:36:00+03:00",
      "note": "Dependency-only KMS/OIDC foundation complete. No AWS resource, env or runtime KMS mutation occurred."
    }
  ],
  "notes": "Completed exact-version dependency addition: @aws-sdk/client-kms 3.1141.0 and @vercel/oidc-aws-credentials-provider 3.3.9. package-lock generated by npm. No secrets or infrastructure mutations."
}
