{
  "$schema": "../task.schema.json",
  "id": "V062-01",
  "title": "v0.6.2 Model Access Levels",
  "status": "verify",
  "priority": "high",
  "files": [
    "src/app/api/models/route.ts",
    "src/app/api/compare/route.ts",
    "src/lib/server/model-catalog.ts",
    "supabase/migrations/",
    "32-model-catalog-governance.md"
  ],
  "checksRequired": [
    "typecheck",
    "lint",
    "build"
  ],
  "checksPassed": [
    "typecheck",
    "lint",
    "build",
    "smoke",
    "test"
  ],
  "lastUpdated": "2026-06-17T10:56:42.248Z",
  "commitHash": null,
  "transitions": [
    {
      "from": null,
      "to": "planned",
      "at": "2026-06-10T00:00:00.000Z",
      "note": "Migrated from 22-codex-action-backlog.md (Backlog task 3)."
    },
    {
      "from": "planned",
      "to": "verify",
      "at": "2026-06-17T10:27:29.645Z",
      "note": "Implementation exists in working tree; awaiting full verification, docs sync and commit."
    },
    {
      "from": "verify",
      "to": "verify",
      "at": "2026-06-17T10:49:34.962Z"
    },
    {
      "from": "verify",
      "to": "verify",
      "at": "2026-06-17T10:49:35.705Z"
    },
    {
      "from": "verify",
      "to": "verify",
      "at": "2026-06-17T10:49:36.477Z"
    },
    {
      "from": "verify",
      "to": "verify",
      "at": "2026-06-17T10:55:14.333Z"
    },
    {
      "from": "verify",
      "to": "verify",
      "at": "2026-06-17T10:56:42.248Z"
    }
  ],
  "notes": "Add models.access_level (anonymous | registered | premium) with DB check constraint. /api/models filters by mode; /api/compare re-checks access on the backend and returns 403 MODEL_NOT_ALLOWED for closed models."
}
