{
  "$schema": "../task.schema.json",
  "id": "V201-10",
  "title": "KMS Live Canary Foundation",
  "status": "done",
  "priority": "high",
  "files": [
    ".project/state.json",
    ".project/tasks/V201-10.json",
    "src/lib/server/credential-kms-canary.ts",
    "src/lib/server/credential-kms-canary.test.ts"
  ],
  "checksRequired": [
    "typecheck",
    "lint",
    "test",
    "build",
    "state:check",
    "docs:check",
    "kms:canary-unit",
    "diff:check",
    "audit"
  ],
  "checksPassed": [
    "typecheck",
    "lint",
    "test",
    "build",
    "state:check",
    "docs:check",
    "kms:canary-unit",
    "diff:check",
    "audit"
  ],
  "lastUpdated": "2026-09-28T22:06:00+03:00",
  "commitHash": "cf7f7d75d675ca6f1f109672ca0638d0aee10398",
  "transitions": [
    {
      "from": null,
      "to": "planned",
      "at": "2026-09-28T21:58:00+03:00",
      "note": "Created while AWS account setup is deferred so the live KMS verification path can be prepared safely in advance."
    },
    {
      "from": "planned",
      "to": "in_progress",
      "at": "2026-09-28T21:58:00+03:00",
      "note": "Add a server-only reusable canary with no route, no persistence, no AWS call until explicitly invoked with a configured data-key provider."
    },
    {
      "from": "in_progress",
      "to": "verify",
      "at": "2026-09-28T22:05:30+03:00",
      "note": "Full PR CI passed audit, typecheck, lint, unit tests, env/model-verifier tests, build, state/docs checks and smoke; Vercel preview succeeded. Canary directly verifies provider-layer encryption-context rejection rather than relying only on AES-GCM AAD."
    },
    {
      "from": "verify",
      "to": "done",
      "at": "2026-09-28T22:06:00+03:00",
      "note": "Reusable server-only KMS canary foundation completed with no route, persistence, AWS resource, env, OpenRouter or paid-traffic activation."
    }
  ],
  "notes": "Ready for later live invocation after AWS CloudFormation/Vercel OIDC setup. Output is safe pass metadata only; no ciphertext, DEK, token or provider secret is returned."
}
